ΠΑΝΕΠΙΣΤΗΜΙΟ ΠΕΛΟΠΟΝΝΗΣΟΥ Διοίκησης Επιχειρήσεων και Οργανισμών;Καλαμάτα;8.810
ΠΑΝΕΠΙΣΤΗΜΙΟ ΑΙΓΑΙΟΥ Πολιτισμικής Τεχνολογίας και Επικοινωνίας;Μυτιλήνη;8.790
ΙΟΝΙΟ ΠΑΝΕΠΙΣΤΗΜΙΟ Περιβάλλοντος;Ζάκυνθος;8.755
ΔΙΕΘΝΕΣ ΠΑΝΕΠΙΣΤΗΜΙΟ ΕΛΛΑΔΑΣ (ΔΙΠΑΕ) Οργάνωσης και Διοίκησης Επιχειρήσεων;Σέρρες;8.750
ΠΑΝΕΠΙΣΤΗΜΙΟ ΠΕΛΟΠΟΝΝΗΣΟΥ Οργάνωσης και Διαχείρισης Αθλητισμού;Σπάρτη;8.750
ΠΑΝΕΠΙΣΤΗΜΙΟ ΠΕΛΟΠΟΝΝΗΣΟΥ Λογιστικής και Χρηματοοικονομικής;Καλαμάτα;8.695
ΠΑΝΕΠΙΣΤΗΜΙΟ ΑΙΓΑΙΟΥ Περιβάλλοντος;Μυτιλήνη;8.650
ΓΕΩΠΟΝΙΚΟ ΠΑΝΕΠΙΣΤΗΜΙΟ ΑΘΗΝΩΝ Διοίκησης Γεωργικών Επιχειρήσεων και Συστημάτων Εφοδιασμού;Θήβα;8.600
ΕΛΛΗΝΙΚΟ ΜΕΣΟΓΕΙΑΚΟ ΠΑΝΕΠΙΣΤΗΜΙΟ (ΕΛΜΕΠΑ) Λογιστικής και Χρηματοοικονομικής;Ηράκλειο;8.580
ΕΛΛΗΝΙΚΟ ΜΕΣΟΓΕΙΑΚΟ ΠΑΝΕΠΙΣΤΗΜΙΟ (ΕΛΜΕΠΑ) Μουσικής Τεχνολογίας και Ακουστικής;Ρέθυμνο;8.350
ΑΚΑΔΗΜΙΕΣ ΕΜΠΟΡΙΚΟΥ ΝΑΥΤΙΚΟΥ (ΑΕΝ) Σχολή Μηχανικών Ισχύουν επιπλέον προϋποθέσεις;(μη προσδιορισμένη);8.350
ΔΙΕΘΝΕΣ ΠΑΝΕΠΙΣΤΗΜΙΟ ΕΛΛΑΔΑΣ (ΔΙΠΑΕ) Δημιουργικού Σχεδιασμού και Ένδυσης;Κιλκίς;8.325
ΑΚΑΔΗΜΙΕΣ ΕΜΠΟΡΙΚΟΥ ΝΑΥΤΙΚΟΥ (ΑΕΝ) Σχολή Πλοιάρχων Ισχύουν επιπλέον προϋποθέσεις;(μη προσδιορισμένη);8.325
ΠΑΝΕΠΙΣΤΗΜΙΟ ΔΥΤΙΚΗΣ ΜΑΚΕΔΟΝΙΑΣ Διεθνών και Ευρωπαϊκών Οικονομικών Σπουδών;Κοζάνη;8.325
ΔΗΜΟΚΡΙΤΕΙΟ ΠΑΝΕΠΙΣΤΗΜΙΟ ΘΡΑΚΗΣ (ΔΠΘ) Διοικητικής Επιστήμης και Τεχνολογίας;Καβάλα;8.270
ΕΛΛΗΝΙΚΟ ΜΕΣΟΓΕΙΑΚΟ ΠΑΝΕΠΙΣΤΗΜΙΟ (ΕΛΜΕΠΑ) Διοικητικής Επιστήμης και Τεχνολογίας;Αγ. Νικόλαος;8.180
ΠΑΝΕΠΙΣΤΗΜΙΟ ΔΥΤΙΚΗΣ ΜΑΚΕΔΟΝΙΑΣ Οργάνωσης και Διοίκησης Επιχειρήσεων;Γρεβενά;8.090
ΠΑΝΕΠΙΣΤΗΜΙΟ ΔΥΤΙΚΗΣ ΜΑΚΕΔΟΝΙΑΣ Διοικητικής Επιστήμης και Τεχνολογίας;Κοζάνη;7.970
ΔΗΜΟΚΡΙΤΕΙΟ ΠΑΝΕΠΙΣΤΗΜΙΟ ΘΡΑΚΗΣ (ΔΠΘ) Λογιστικής και Χρηματοοικονομικής;Καβάλα;7.920
ΠΑΝΕΠΙΣΤΗΜΙΟ ΑΙΓΑΙΟΥ Γεωγραφίας;Μυτιλήνη;7.870
ΠΑΝΕΠΙΣΤΗΜΙΟ ΑΙΓΑΙΟΥ Διοίκησης Επιχειρήσεων;Χίος;7.830
ΠΑΝΕΠΙΣΤΗΜΙΟ ΙΩΑΝΝΙΝΩΝ Λογιστικής και Χρηματοοικονομικής;Πρέβεζα;7.570
ΠΑΝΕΠΙΣΤΗΜΙΟ ΔΥΤΙΚΗΣ ΜΑΚΕΔΟΝΙΑΣ Λογιστικής και Χρηματοοικονομικής;Κοζάνη;7.550
ΠΑΝΕΠΙΣΤΗΜΙΟ ΔΥΤΙΚΗΣ ΜΑΚΕΔΟΝΙΑΣ Στατιστικής;Γρεβενά;7.415
ΓΕΩΠΟΝΙΚΟ ΠΑΝΕΠΙΣΤΗΜΙΟ ΑΘΗΝΩΝ Περιφερειακής και Οικονομικής Ανάπτυξης;Άμφισσα;6.8600
