ΣΧΟΛΗ ΙΚΑΡΩΝ (ΣΙ) Ικάρων (ΣΙ) Έρευνας Πληροφορικής (ΕΠ) Ισχύουν επιπλέον προϋποθέσεις;(μη προσδιορισμένη);18.435
ΠΑΝΕΠΙΣΤΗΜΙΟ ΠΕΙΡΑΙΑ Ναυτιλιακών Σπουδών Ειδικό μάθημα: Αγγλικά;Πειραιάς;18.320
ΟΙΚΟΝΟΜΙΚΟ ΠΑΝΕΠΙΣΤΗΜΙΟ ΑΘΗΝΩΝ (ΟΠΑ) Διοικητικής Επιστήμης και Τεχνολογίας;Αθήνα;18.175
ΣΧΟΛΗ ΙΚΑΡΩΝ (ΣΙ) Ικάρων (ΣΙ) Εφοδιαστών (Ε) Ισχύουν επιπλέον προϋποθέσεις;(μη προσδιορισμένη);17.890
ΣΤΡΑΤΙΩΤΙΚΗ ΣΧΟΛΗ ΑΞΙΩΜΑΤΙΚΩΝ ΣΩΜΑΤΩΝ (ΣΣΑΣ) Οικονομικό (ΣΣΑΣ) Ισχύουν επιπλέον προϋποθέσεις;Θεσσαλονίκη;17.875
ΠΥΡΟΣΒΕΣΤΙΚΗ ΑΚΑΔΗΜΙΑ (ΣΠΑ) Αξιωματικών Πυροσβεστικής Ακαδημίας (Μόνο για Πολίτες) Ισχύουν επιπλέον προϋποθέσεις;(μη προσδιορισμένη);17.850
ΑΣΤΥΝΟΜΙΚΕΣ ΣΧΟΛΕΣ Αξιωματικών Ελληνικής Αστυνομίας (Μόνο για Πολίτες) Ισχύουν επιπλέον προϋποθέσεις;(μη προσδιορισμένη);17.50
ΣΧΟΛΗ ΙΚΑΡΩΝ (ΣΙ) Ικάρων (ΣΙ) Διοικητικών (Δ) Ισχύουν επιπλέον προϋποθέσεις;(μη προσδιορισμένη);17.485
ΑΡΙΣΤΟΤΕΛΕΙΟ ΠΑΝΕΠΙΣΤΗΜΙΟ ΘΕΣΣΑΛΟΝΙΚΗΣ (ΑΠΘ) Πληροφορικής;Θεσσαλονίκη;17.440
ΑΣΤΥΝΟΜΙΚΕΣ ΣΧΟΛΕΣ Αξιωματικών Ελληνικής Αστυνομίας (Μόνο για Αστυνομικούς) Ισχύουν επιπλέον προϋποθέσεις;(μη προσδιορισμένη);17.240
ΟΙΚΟΝΟΜΙΚΟ ΠΑΝΕΠΙΣΤΗΜΙΟ ΑΘΗΝΩΝ (ΟΠΑ) Πληροφορικής;Αθήνα;17.220
ΕΘΝΙΚΟ , ΚΑΠΟΔΙΣΤΡΙΑΚΟ ΠΑΝΕΠΙΣΤΗΜΙΟ ΑΘΗΝΩΝ (ΕΚΠΑ) Επιστήμης Φυσικής Αγωγής και Αθλητισμού Εξέταση σε αγωνίσματα;Αθήνα;17.096
ΕΘΝΙΚΟ , ΚΑΠΟΔΙΣΤΡΙΑΚΟ ΠΑΝΕΠΙΣΤΗΜΙΟ ΑΘΗΝΩΝ (ΕΚΠΑ) Πληροφορικής και Τηλεπικοινωνιών;Αθήνα;17.075
ΛΙΜΕΝΙΚΟ ΣΩΜΑ. - ΕΛΛΗΝΙΚΗ ΑΚΤΟΦΥΛΑΚΗ (ΛΣ-ΕΛΑΚΤ) Σχολή Δοκίμων Σημαιοφόρων Λιμενικού Σώματος - Ελληνικής Ακτοφυλακής (Σ.Δ.Σ.Λ.Σ. - ΕΛ.ΑΚΤ.) Ισχύουν επιπλέον προϋποθέσεις;(μη προσδιορισμένη);17.040
ΟΙΚΟΝΟΜΙΚΟ ΠΑΝΕΠΙΣΤΗΜΙΟ ΑΘΗΝΩΝ (ΟΠΑ) Οργάνωσης και Διοίκησης Επιχειρήσεων;Αθήνα;17.025
ΣΧΟΛΗ ΜΟΝΙΜΩΝ ΥΠΑΞΙΩΜΑΤΙΚΩΝ ΑΕΡΟΠΟΡΙΑΣ (ΣΜΥΑ) Μονίμων Υπαξιωματικών Αεροπορίας (ΣΜΥΑ) - Κατεύθυνση Διοικητικής και Εφοδιαστικής Υποστήριξης Ισχύουν επιπλέον προϋποθέσεις;(μη προσδιορισμένη);16.825
ΑΡΙΣΤΟΤΕΛΕΙΟ ΠΑΝΕΠΙΣΤΗΜΙΟ ΘΕΣΣΑΛΟΝΙΚΗΣ (ΑΠΘ) Επιστήμης Φυσικής Αγωγής και Αθλητισμού Εξέταση σε αγωνίσματα;Θεσσαλονίκη;16.811
ΠΑΝΕΠΙΣΤΗΜΙΟ ΠΕΙΡΑΙΑ Διεθνών και Ευρωπαϊκών Σπουδών Ειδικό μάθημα: Ένα από τα Αγγλικά, Γαλλικά, Γερμανικά, Ιταλικά;Πειραιάς;16.795
ΠΑΝΕΠΙΣΤΗΜΙΟ ΠΕΙΡΑΙΑ Πληροφορικής;Πειραιάς;16.740
ΠΑΝΕΠΙΣΤΗΜΙΟ ΜΑΚΕΔΟΝΙΑΣ (ΠΑΜΑΚ) Εφαρμοσμένης Πληροφορικής - Επιστήμη και Τεχνολογία Υπολογιστών;Θεσσαλονίκη;16.735
ΠΑΝΤΕΙΟ ΠΑΝΕΠΙΣΤΗΜΙΟ ΚΟΙΝΩΝΙΚΩΝ ΚΑΙ ΠΟΛΙΤΙΚΩΝ ΕΠΙΣΤΗΜΩΝ (ΠΑΝΤΕΙΟ) Διεθνών και Ευρωπαϊκών Σπουδών Ειδικό μάθημα: Ένα από τα Αγγλικά, Γαλλικά, Γερμανικά, Ιταλικά;Αθήνα;16.480
ΠΑΝΕΠΙΣΤΗΜΙΟ ΜΑΚΕΔΟΝΙΑΣ (ΠΑΜΑΚ) Εφαρμοσμένης Πληροφορικής - Πληροφοριακά Συστήματα;Θεσσαλονίκη;16.375
ΠΑΝΕΠΙΣΤΗΜΙΟ ΠΕΙΡΑΙΑ Οργάνωσης και Διοίκησης Επιχειρήσεων;Πειραιάς;16.180
ΧΑΡΟΚΟΠΕΙΟ ΠΑΝΕΠΙΣΤΗΜΙΟ Πληροφορικής και Τηλεματικής;Αθήνα;16.170
ΑΡΙΣΤΟΤΕΛΕΙΟ ΠΑΝΕΠΙΣΤΗΜΙΟ ΘΕΣΣΑΛΟΝΙΚΗΣ (ΑΠΘ) Παιδαγωγικό Δημοτικής Εκπαίδευσης;Θεσσαλονίκη;16.100
ΕΘΝΙΚΟ , ΚΑΠΟΔΙΣΤΡΙΑΚΟ ΠΑΝΕΠΙΣΤΗΜΙΟ ΑΘΗΝΩΝ (ΕΚΠΑ) Παιδαγωγικό Δημοτικής Εκπαίδευσης;Αθήνα;16.100
ΛΙΜΕΝΙΚΟ ΣΩΜΑ. - ΕΛΛΗΝΙΚΗ ΑΚΤΟΦΥΛΑΚΗ (ΛΣ-ΕΛΑΚΤ) Σχολή Δοκίμων Λιμενοφυλάκων Ισχύουν επιπλέον προϋποθέσεις;(μη προσδιορισμένη);16.030
ΟΙΚΟΝΟΜΙΚΟ ΠΑΝΕΠΙΣΤΗΜΙΟ ΑΘΗΝΩΝ (ΟΠΑ) Μάρκετινγκ και Επικοινωνίας;Αθήνα;15.975
ΠΑΝΕΠΙΣΤΗΜΙΟ ΠΕΙΡΑΙΑ Ψηφιακών Συστημάτων;Πειραιάς;15.830
ΠΑΝΕΠΙΣΤΗΜΙΟ ΚΡΗΤΗΣ Επιστήμης Υπολογιστών;Ηράκλειο;15.813
ΟΙΚΟΝΟΜΙΚΟ ΠΑΝΕΠΙΣΤΗΜΙΟ ΑΘΗΝΩΝ (ΟΠΑ) Οικονομικής Επιστήμης;Αθήνα;15.700
ΠΥΡΟΣΒΕΣΤΙΚΗ ΑΚΑΔΗΜΙΑ (ΣΠΑ) Πυροσβεστών (Μόνο για Πολίτες) Ισχύουν επιπλέον προϋποθέσεις;(μη προσδιορισμένη);15.660
ΠΑΝΕΠΙΣΤΗΜΙΟ ΜΑΚΕΔΟΝΙΑΣ (ΠΑΜΑΚ) Μουσικής Επιστήμης και Τέχνης Ειδικά Μαθήματα: «Μουσική Εκτέλεση και Ερμηνεία» και «Μουσική Αντίληψη, Θεωρία και Αρμονία».;Θεσσαλονίκη;15.380
ΠΑΝΕΠΙΣΤΗΜΙΟ ΔΥΤΙΚΗΣ ΑΤΤΙΚΗΣ Μηχανικών Πληροφορικής και Υπολογιστών;Αιγάλεω;15.380
ΠΑΝΕΠΙΣΤΗΜΙΟ ΜΑΚΕΔΟΝΙΑΣ (ΠΑΜΑΚ) Οργάνωσης και Διοίκησης Επιχειρήσεων;Θεσσαλονίκη;15.375
ΟΙΚΟΝΟΜΙΚΟ ΠΑΝΕΠΙΣΤΗΜΙΟ ΑΘΗΝΩΝ (ΟΠΑ) Λογιστικής και Χρηματοοικονομικής;Αθήνα;15.340
ΠΑΝΕΠΙΣΤΗΜΙΟ ΙΩΑΝΝΙΝΩΝ Μουσικών Σπουδών Ειδικά Μαθήματα: «Μουσική Εκτέλεση και Ερμηνεία» και «Μουσική Αντίληψη, Θεωρία και Αρμονία».;Άρτα;15.250
ΠΑΝΕΠΙΣΤΗΜΙΟ ΘΕΣΣΑΛΙΑΣ Παιδαγωγικό Δημοτικής Εκπαίδευσης;Βόλος;15.200
ΔΙΕΘΝΕΣ ΠΑΝΕΠΙΣΤΗΜΙΟ ΕΛΛΑΔΑΣ (ΔΙΠΑΕ) Μηχανικών Πληροφορικής και Ηλεκτρονικών Συστημάτων;Θεσσαλονίκη;15.030
ΠΑΝΕΠΙΣΤΗΜΙΟ ΠΕΙΡΑΙΑ Τουριστικών Σπουδών Ειδικό μάθημα: Αγγλικά;Πειραιάς;14.985
ΣΧΟΛΗ ΜΟΝΙΜΩΝ ΥΠΑΞΙΩΜΑΤΙΚΩΝ ΣΤΡΑΤΟΥ ΞΗΡΑΣ (ΣΜΥ) Μονίμων Υπαξιωματικών Στρατού (ΣΜΥ) - Σώματα Ισχύουν επιπλέον προϋποθέσεις;(μη προσδιορισμένη);14.890
ΠΑΝΕΠΙΣΤΗΜΙΟ ΘΕΣΣΑΛΙΑΣ Επιστήμης Φυσικής Αγωγής και Αθλητισμού Εξέταση σε αγωνίσματα;Τρίκαλα;14.860
ΕΘΝΙΚΟ , ΚΑΠΟΔΙΣΤΡΙΑΚΟ ΠΑΝΕΠΙΣΤΗΜΙΟ ΑΘΗΝΩΝ (ΕΚΠΑ) Εκπαίδευσης και Αγωγής στην Προσχολική Ηλικία;Αθήνα;14.800
ΟΙΚΟΝΟΜΙΚΟ ΠΑΝΕΠΙΣΤΗΜΙΟ ΑΘΗΝΩΝ (ΟΠΑ) Διεθνών και Ευρωπαϊκών Οικονομικών Σπουδών;Αθήνα;14.790
ΕΘΝΙΚΟ , ΚΑΠΟΔΙΣΤΡΙΑΚΟ ΠΑΝΕΠΙΣΤΗΜΙΟ ΑΘΗΝΩΝ (ΕΚΠΑ) Διοίκησης Επιχειρήσεων και Οργανισμών;Αθήνα;14.760
ΠΥΡΟΣΒΕΣΤΙΚΗ ΑΚΑΔΗΜΙΑ (ΣΠΑ) Αξιωματικών Πυροσβεστικής Ακαδημίας (Μόνο για Πυροσβέστες) Ισχύουν επιπλέον προϋποθέσεις;(μη προσδιορισμένη);14.750
ΠΑΝΕΠΙΣΤΗΜΙΟ ΠΕΙΡΑΙΑ Οικονομικής Επιστήμης;Πειραιάς;14.660
ΠΑΝΕΠΙΣΤΗΜΙΟ ΙΩΑΝΝΙΝΩΝ Παιδαγωγικό Δημοτικής Εκπαίδευσης;Ιωάννινα;14.600
ΠΑΝΕΠΙΣΤΗΜΙΟ ΠΕΙΡΑΙΑ Χρηματοοικονομικής και Τραπεζικής Διοικητικής;Πειραιάς;14.550
ΠΑΝΕΠΙΣΤΗΜΙΟ ΠΑΤΡΩΝ Επιστημών της Εκπαίδευσης και Κοινωνικής Εργασίας;Πάτρα;14.520
ΕΘΝΙΚΟ , ΚΑΠΟΔΙΣΤΡΙΑΚΟ ΠΑΝΕΠΙΣΤΗΜΙΟ ΑΘΗΝΩΝ (ΕΚΠΑ) Μουσικών Σπουδών Ειδικά Μαθήματα: «Μουσική Εκτέλεση και Ερμηνεία» και «Μουσική Αντίληψη, Θεωρία και Αρμονία».;Αθήνα;14.510
ΑΡΙΣΤΟΤΕΛΕΙΟ ΠΑΝΕΠΙΣΤΗΜΙΟ ΘΕΣΣΑΛΟΝΙΚΗΣ (ΑΠΘ) Μουσικών Σπουδών Ειδικά Μαθήματα: «Μουσική Εκτέλεση και Ερμηνεία» και «Μουσική Αντίληψη, Θεωρία και Αρμονία».;Θεσσαλονίκη;14.310
ΠΑΝΕΠΙΣΤΗΜΙΟ ΜΑΚΕΔΟΝΙΑΣ (ΠΑΜΑΚ) Οικονομικών Επιστημών;Θεσσαλονίκη;14.210
ΑΡΙΣΤΟΤΕΛΕΙΟ ΠΑΝΕΠΙΣΤΗΜΙΟ ΘΕΣΣΑΛΟΝΙΚΗΣ (ΑΠΘ) Επιστημών Προσχολικής Αγωγής και Εκπαίδευσης;Θεσσαλονίκη;14.175
ΟΙΚΟΝΟΜΙΚΟ ΠΑΝΕΠΙΣΤΗΜΙΟ ΑΘΗΝΩΝ (ΟΠΑ) Στατιστικής;Αθήνα;13.982
ΑΡΙΣΤΟΤΕΛΕΙΟ ΠΑΝΕΠΙΣΤΗΜΙΟ ΘΕΣΣΑΛΟΝΙΚΗΣ (ΑΠΘ) Επιστήμης Φυσικής Αγωγής και Αθλητισμού Εξέταση σε αγωνίσματα;Σέρρες;13.945
ΠΑΝΕΠΙΣΤΗΜΙΟ ΜΑΚΕΔΟΝΙΑΣ (ΠΑΜΑΚ) Λογιστικής και Χρηματοοικονομικής;Θεσσαλονίκη;13.775
ΠΑΝΕΠΙΣΤΗΜΙΟ ΔΥΤΙΚΗΣ ΑΤΤΙΚΗΣ Διοίκησης Τουρισμού Ειδικό μάθημα: Ένα από τα Αγγλικά, Γαλλικά, Γερμανικά, Ιταλικά;Αιγάλεω;13.710
ΠΑΝΕΠΙΣΤΗΜΙΟ ΚΡΗΤΗΣ Παιδαγωγικό Δημοτικής Εκπαίδευσης;Ρέθυμνο;13.625
ΕΘΝΙΚΟ , ΚΑΠΟΔΙΣΤΡΙΑΚΟ ΠΑΝΕΠΙΣΤΗΜΙΟ ΑΘΗΝΩΝ (ΕΚΠΑ) Οικονομικών Επιστημών;Αθήνα;13.574
ΠΑΝΕΠΙΣΤΗΜΙΟ ΔΥΤΙΚΗΣ ΑΤΤΙΚΗΣ Εσωτερικής Αρχιτεκτονικής Ειδικά μαθήματα: Ελεύθερο και Γραμμικό Σχέδιο;Αιγάλεω;13.475
ΠΑΝΕΠΙΣΤΗΜΙΟ ΠΕΙΡΑΙΑ Βιομηχανικής Διοίκησης και Τεχνολογίας;Πειραιάς;13.460
ΔΗΜΟΚΡΙΤΕΙΟ ΠΑΝΕΠΙΣΤΗΜΙΟ ΘΡΑΚΗΣ (ΔΠΘ) Επιστήμης Φυσικής Αγωγής και Αθλητισμού Εξέταση σε αγωνίσματα;Κομοτηνή;13.444
ΔΙΕΘΝΕΣ ΠΑΝΕΠΙΣΤΗΜΙΟ ΕΛΛΑΔΑΣ (ΔΙΠΑΕ) Μηχανικών Πληροφορικής, Υπολογιστών και Τηλεπικοινωνιών;Σέρρες;13.440
ΠΑΝΕΠΙΣΤΗΜΙΟ ΔΥΤΙΚΗΣ ΑΤΤΙΚΗΣ Γραφιστικής και Οπτικής Επικοινωνίας Ειδικά μαθήματα: Ελεύθερο και Γραμμικό Σχέδιο;Αιγάλεω;13.325
ΑΣΤΥΝΟΜΙΚΕΣ ΣΧΟΛΕΣ Αστυφυλάκων (Μόνο για Πολίτες) Ισχύουν επιπλέον προϋποθέσεις;(μη προσδιορισμένη);13.180
ΠΑΝΤΕΙΟ ΠΑΝΕΠΙΣΤΗΜΙΟ ΚΟΙΝΩΝΙΚΩΝ ΚΑΙ ΠΟΛΙΤΙΚΩΝ ΕΠΙΣΤΗΜΩΝ (ΠΑΝΤΕΙΟ) Δημόσιας Διοίκησης;Αθήνα;13.125
ΠΑΝΕΠΙΣΤΗΜΙΟ ΘΕΣΣΑΛΙΑΣ Παιδαγωγικό Ειδικής Αγωγής;Βόλος;13.100
ΠΑΝΕΠΙΣΤΗΜΙΟ ΠΑΤΡΩΝ Επιστημών της Εκπαίδευσης και της Αγωγής στην Προσχολική Ηλικία;Πάτρα;13.100
ΑΡΙΣΤΟΤΕΛΕΙΟ ΠΑΝΕΠΙΣΤΗΜΙΟ ΘΕΣΣΑΛΟΝΙΚΗΣ (ΑΠΘ) Οικονομικών Επιστημών;Θεσσαλονίκη;13.090
ΔΗΜΟΚΡΙΤΕΙΟ ΠΑΝΕΠΙΣΤΗΜΙΟ ΘΡΑΚΗΣ (ΔΠΘ) Παιδαγωγικό Δημοτικής Εκπαίδευσης;Αλεξ/πολη;13.025
ΠΑΝΕΠΙΣΤΗΜΙΟ ΔΥΤΙΚΗΣ ΜΑΚΕΔΟΝΙΑΣ Παιδαγωγικό Δημοτικής Εκπαίδευσης;Φλώρινα;12.980
ΑΡΙΣΤΟΤΕΛΕΙΟ ΠΑΝΕΠΙΣΤΗΜΙΟ ΘΕΣΣΑΛΟΝΙΚΗΣ (ΑΠΘ) Κινηματογράφου;Θεσσαλονίκη;12.975
ΠΑΝΕΠΙΣΤΗΜΙΟ ΔΥΤΙΚΗΣ ΑΤΤΙΚΗΣ Αγωγής και Φροντίδας στην Πρώιμη Παιδική Ηλικία;Αιγάλεω;12.920
ΙΟΝΙΟ ΠΑΝΕΠΙΣΤΗΜΙΟ Μουσικών Σπουδών Ειδικά Μαθήματα: «Μουσική Εκτέλεση και Ερμηνεία» και «Μουσική Αντίληψη, Θεωρία και Αρμονία».;Κέρκυρα;12.880
ΠΑΝΕΠΙΣΤΗΜΙΟ ΠΕΙΡΑΙΑ Στατιστικής και Ασφαλιστικής Επιστήμης;Πειραιάς;12.755
ΠΑΝΕΠΙΣΤΗΜΙΟ ΘΕΣΣΑΛΙΑΣ Πληροφορικής με Εφαρμογές στη Βιοϊατρική;Λαμία;12.725
ΠΑΝΤΕΙΟ ΠΑΝΕΠΙΣΤΗΜΙΟ ΚΟΙΝΩΝΙΚΩΝ ΚΑΙ ΠΟΛΙΤΙΚΩΝ ΕΠΙΣΤΗΜΩΝ (ΠΑΝΤΕΙΟ) Οικονομικής και Περιφερειακής Ανάπτυξης;Αθήνα;12.675
ΠΑΝΕΠΙΣΤΗΜΙΟ ΔΥΤΙΚΗΣ ΑΤΤΙΚΗΣ Διοίκησης Επιχειρήσεων;Αιγάλεω;12.560
ΧΑΡΟΚΟΠΕΙΟ ΠΑΝΕΠΙΣΤΗΜΙΟ Οικονομίας και Βιώσιμης Ανάπτυξης;Αθήνα;12.552
ΔΙΕΘΝΕΣ ΠΑΝΕΠΙΣΤΗΜΙΟ ΕΛΛΑΔΑΣ (ΔΙΠΑΕ) Εσωτερικής Αρχιτεκτονικής Ειδικά μαθήματα: Ελεύθερο και Γραμμικό Σχέδιο;Σέρρες;12.550
ΠΑΝΕΠΙΣΤΗΜΙΟ ΘΕΣΣΑΛΙΑΣ Πληροφορικής και Τηλεπικοινωνιών;Λαμία;12.375
ΠΑΝΕΠΙΣΤΗΜΙΟ ΘΕΣΣΑΛΙΑΣ Παιδαγωγικό Προσχολικής Εκπαίδευσης;Βόλος;12.325
ΠΑΝΕΠΙΣΤΗΜΙΟ ΠΑΤΡΩΝ Διοίκησης Τουρισμού Ειδικό μάθημα: Ένα από τα Αγγλικά, Γαλλικά, Γερμανικά, Ιταλικά;Πάτρα;12.325
ΠΑΝΕΠΙΣΤΗΜΙΟ ΔΥΤΙΚΗΣ ΑΤΤΙΚΗΣ Λογιστικής και Χρηματοοικονομικής;Αιγάλεω;12.321
ΓΕΩΠΟΝΙΚΟ ΠΑΝΕΠΙΣΤΗΜΙΟ ΑΘΗΝΩΝ Αγροτικής Οικονομίας και Ανάπτυξης;Αθήνα;12.290
ΠΑΝΕΠΙΣΤΗΜΙΟ ΠΑΤΡΩΝ Οικονομικών Επιστημών;Πάτρα;12.290
ΠΑΝΤΕΙΟ ΠΑΝΕΠΙΣΤΗΜΙΟ ΚΟΙΝΩΝΙΚΩΝ ΚΑΙ ΠΟΛΙΤΙΚΩΝ ΕΠΙΣΤΗΜΩΝ (ΠΑΝΤΕΙΟ) Κοινωνικής Πολιτικής;Αθήνα;12.210
ΔΗΜΟΚΡΙΤΕΙΟ ΠΑΝΕΠΙΣΤΗΜΙΟ ΘΡΑΚΗΣ (ΔΠΘ) Πληροφορικής;Καβάλα;12.135
ΠΑΝΕΠΙΣΤΗΜΙΟ ΑΙΓΑΙΟΥ Παιδαγωγικό Δημοτικής Εκπαίδευσης;Ρόδος;12.125
ΠΑΝΕΠΙΣΤΗΜΙΟ ΚΡΗΤΗΣ Παιδαγωγικό Προσχολικής Εκπαίδευσης;Ρέθυμνο;12.040
ΠΟΛΥΤΕΧΝΕΙΟ ΚΡΗΤΗΣ Μηχανικών Παραγωγής και Διοίκησης;Χανιά;12.030
ΠΑΝΕΠΙΣΤΗΜΙΟ ΙΩΑΝΝΙΝΩΝ Παιδαγωγικό Νηπιαγωγών;Ιωάννινα;11.970
ΔΙΕΘΝΕΣ ΠΑΝΕΠΙΣΤΗΜΙΟ ΕΛΛΑΔΑΣ (ΔΙΠΑΕ) Λογιστικής και Πληροφοριακών Συστημάτων;Θεσσαλονίκη;11.960
ΑΝΩΤΕΡΕΣ ΣΧΟΛΕΣ ΤΟΥΡΙΣΤΙΚΗΣ ΕΚΠΑΙΔΕΥΣΗΣ (ΑΣΤΕ) Ανώτερη Σχολή Τουριστικής Εκπαίδευσης Κρήτης (ΑΣΤΕΚ) Ειδικό μάθημα: Ένα από τα Αγγλικά, Γαλλικά, Γερμανικά, Ιταλικά;Αγ. Νικόλαος;11.912
ΔΙΕΘΝΕΣ ΠΑΝΕΠΙΣΤΗΜΙΟ ΕΛΛΑΔΑΣ (ΔΙΠΑΕ) Μηχανικών Παραγωγής και Διοίκησης;Θεσσαλονίκη;11.90
ΠΑΝΕΠΙΣΤΗΜΙΟ ΜΑΚΕΔΟΝΙΑΣ (ΠΑΜΑΚ) Βαλκανικών, Σλαβικών και Ανατολικών Σπουδών;Θεσσαλονίκη;11.840
ΠΑΝΕΠΙΣΤΗΜΙΟ ΔΥΤΙΚΗΣ ΑΤΤΙΚΗΣ Μηχανικών Βιομηχανικής Σχεδίασης και Παραγωγής;Αιγάλεω;11.832
ΠΑΝΕΠΙΣΤΗΜΙΟ ΘΕΣΣΑΛΙΑΣ Οικονομικών Επιστημών;Βόλος;11.795
ΑΝΩΤΕΡΕΣ ΣΧΟΛΕΣ ΤΟΥΡΙΣΤΙΚΗΣ ΕΚΠΑΙΔΕΥΣΗΣ (ΑΣΤΕ) Ανώτερη Σχολή Τουριστικής Εκπαίδευσης Ρόδου (ΑΣΤΕΡ) Ειδικό μάθημα: Ένα από τα Αγγλικά, Γαλλικά, Γερμανικά, Ιταλικά;Ρόδος;11.678
ΠΑΝΕΠΙΣΤΗΜΙΟ ΔΥΤΙΚΗΣ ΑΤΤΙΚΗΣ Φωτογραφίας και Οπτικοακουστικών Τεχνών;Αιγάλεω;11.640
ΔΙΕΘΝΕΣ ΠΑΝΕΠΙΣΤΗΜΙΟ ΕΛΛΑΔΑΣ (ΔΙΠΑΕ) Διοίκησης Οργανισμών, Marketing και Τουρισμού;Θεσσαλονίκη;11.630
ΠΑΝΕΠΙΣΤΗΜΙΟ ΠΑΤΡΩΝ Διοίκησης Επιχειρήσεων;Πάτρα;11.625
ΑΡΙΣΤΟΤΕΛΕΙΟ ΠΑΝΕΠΙΣΤΗΜΙΟ ΘΕΣΣΑΛΟΝΙΚΗΣ (ΑΠΘ) Θεάτρου;Θεσσαλονίκη;11.625
ΔΗΜΟΚΡΙΤΕΙΟ ΠΑΝΕΠΙΣΤΗΜΙΟ ΘΡΑΚΗΣ (ΔΠΘ) Μηχανικών Παραγωγής και Διοίκησης;Ξάνθη;11.490
ΔΙΕΘΝΕΣ ΠΑΝΕΠΙΣΤΗΜΙΟ ΕΛΛΑΔΑΣ (ΔΙΠΑΕ) Αγωγής και Φροντίδας στην Πρώιμη Παιδική Ηλικία;Θεσσαλονίκη;11.475
ΠΑΝΕΠΙΣΤΗΜΙΟ ΠΕΛΟΠΟΝΝΗΣΟΥ Πληροφορικής και Τηλεπικοινωνιών;Τρίπολη;11.425
ΧΑΡΟΚΟΠΕΙΟ ΠΑΝΕΠΙΣΤΗΜΙΟ Γεωγραφίας;Αθήνα;11.425
ΠΑΝΕΠΙΣΤΗΜΙΟ ΙΩΑΝΝΙΝΩΝ Οικονομικών Επιστημών;Ιωάννινα;11.375
ΔΗΜΟΚΡΙΤΕΙΟ ΠΑΝΕΠΙΣΤΗΜΙΟ ΘΡΑΚΗΣ (ΔΠΘ) Κοινωνικής Πολιτικής;Κομοτηνή;11.280
ΠΑΝΕΠΙΣΤΗΜΙΟ ΔΥΤΙΚΗΣ ΜΑΚΕΔΟΝΙΑΣ Επικοινωνίας και Ψηφιακών Μέσων Ειδικό μάθημα: Ένα από τα Αγγλικά, Γαλλικά, Γερμανικά, Ιταλικά;Καστοριά;11.270
ΠΑΝΕΠΙΣΤΗΜΙΟ ΙΩΑΝΝΙΝΩΝ Αγωγής και Φροντίδας στην Πρώιμη Παιδική Ηλικία;Ιωάννινα;11.222
ΠΑΝΕΠΙΣΤΗΜΙΟ ΔΥΤΙΚΗΣ ΜΑΚΕΔΟΝΙΑΣ Παιδαγωγικό Νηπιαγωγών;Φλώρινα;11.200
ΣΧΟΛΗ ΜΟΝΙΜΩΝ ΥΠΑΞΙΩΜΑΤΙΚΩΝ ΝΑΥΤΙΚΟΥ (ΣΜΥΝ) Μονίμων Υπαξιωματικών Ναυτικού (ΣΜΥΝ) Ισχύουν επιπλέον προϋποθέσεις;(μη προσδιορισμένη);11.080
ΔΗΜΟΚΡΙΤΕΙΟ ΠΑΝΕΠΙΣΤΗΜΙΟ ΘΡΑΚΗΣ (ΔΠΘ) Επιστημών της Εκπαίδευσης στην Προσχολική Ηλικία;Αλεξ/πολη;11.050
ΠΑΝΕΠΙΣΤΗΜΙΟ ΑΙΓΑΙΟΥ Οικονομικής και Διοίκησης Τουρισμού Ειδικό μάθημα: Αγγλικά;Χίος;10.975
ΕΘΝΙΚΟ , ΚΑΠΟΔΙΣΤΡΙΑΚΟ ΠΑΝΕΠΙΣΤΗΜΙΟ ΑΘΗΝΩΝ (ΕΚΠΑ) Ιστορίας και Φιλοσοφίας της Επιστήμης;Αθήνα;10.966
ΠΑΝΕΠΙΣΤΗΜΙΟ ΠΑΤΡΩΝ Διοικητικής Επιστήμης και Τεχνολογίας;Πάτρα;10.940
ΕΘΝΙΚΟ , ΚΑΠΟΔΙΣΤΡΙΑΚΟ ΠΑΝΕΠΙΣΤΗΜΙΟ ΑΘΗΝΩΝ (ΕΚΠΑ) Διαχείρισης Λιμένων και Ναυτιλίας;Ψαχνά Εύβοιας;10.925
ΠΑΝΕΠΙΣΤΗΜΙΟ ΚΡΗΤΗΣ Οικονομικών Επιστημών;Ρέθυμνο;10.925
ΕΘΝΙΚΟ , ΚΑΠΟΔΙΣΤΡΙΑΚΟ ΠΑΝΕΠΙΣΤΗΜΙΟ ΑΘΗΝΩΝ (ΕΚΠΑ) Ψηφιακών Τεχνών και Κινηματογράφου;Ψαχνά Εύβοιας;10.640
ΠΑΝΕΠΙΣΤΗΜΙΟ ΑΙΓΑΙΟΥ Επιστημών της Προσχολικής Αγωγής και Εκπαιδευτικού Σχεδιασμού;Ρόδος;10.525
ΠΑΝΕΠΙΣΤΗΜΙΟ ΔΥΤΙΚΗΣ ΜΑΚΕΔΟΝΙΑΣ Πληροφορικής;Καστοριά;10.500
ΠΑΝΕΠΙΣΤΗΜΙΟ ΘΕΣΣΑΛΙΑΣ Ψηφιακών Συστημάτων;Λάρισα;10.400
ΕΛΛΗΝΙΚΟ ΜΕΣΟΓΕΙΑΚΟ ΠΑΝΕΠΙΣΤΗΜΙΟ (ΕΛΜΕΠΑ) Διοίκησης Επιχειρήσεων και Τουρισμού;Ηράκλειο;10.072
ΕΘΝΙΚΟ , ΚΑΠΟΔΙΣΤΡΙΑΚΟ ΠΑΝΕΠΙΣΤΗΜΙΟ ΑΘΗΝΩΝ (ΕΚΠΑ) Αγροτικής Ανάπτυξης, Αγροδιατροφής και Διαχείρισης Φυσικών Πόρων;Ψαχνά Εύβοιας;9.970
ΠΑΝΕΠΙΣΤΗΜΙΟ ΑΙΓΑΙΟΥ Ναυτιλίας και Επιχειρηματικών Υπηρεσιών;Χίος;9.850
ΠΑΝΕΠΙΣΤΗΜΙΟ ΘΕΣΣΑΛΙΑΣ Περιβάλλοντος;Λάρισα;9.845
ΠΑΝΕΠΙΣΤΗΜΙΟ ΑΙΓΑΙΟΥ Μηχανικών Πληροφοριακών και Επικοινωνιακών Συστημάτων;Σάμος;9.800
ΔΗΜΟΚΡΙΤΕΙΟ ΠΑΝΕΠΙΣΤΗΜΙΟ ΘΡΑΚΗΣ (ΔΠΘ) Οικονομικών Επιστημών;Κομοτηνή;9.764
ΕΛΛΗΝΙΚΟ ΜΕΣΟΓΕΙΑΚΟ ΠΑΝΕΠΙΣΤΗΜΙΟ (ΕΛΜΕΠΑ) Ηλεκτρονικών Μηχανικών;Χανιά;9.740
ΠΑΝΕΠΙΣΤΗΜΙΟ ΠΕΛΟΠΟΝΝΗΣΟΥ Οικονομικών Επιστημών;Τρίπολη;9.670
ΙΟΝΙΟ ΠΑΝΕΠΙΣΤΗΜΙΟ Πληροφορικής;Κέρκυρα;9.630
ΠΑΝΕΠΙΣΤΗΜΙΟ ΙΩΑΝΝΙΝΩΝ Πληροφορικής και Τηλεπικοινωνιών;Άρτα;9.625
ΙΟΝΙΟ ΠΑΝΕΠΙΣΤΗΜΙΟ Τουρισμού Ειδικό μάθημα: Αγγλικά;Κέρκυρα;9.620
ΙΟΝΙΟ ΠΑΝΕΠΙΣΤΗΜΙΟ Τεχνών Ήχου και Εικόνας;Κέρκυρα;9.570
ΔΙΕΘΝΕΣ ΠΑΝΕΠΙΣΤΗΜΙΟ ΕΛΛΑΔΑΣ (ΔΙΠΑΕ) Διοίκησης Εφοδιαστικής Αλυσίδας;Κατερίνη;9.520
ΠΑΝΕΠΙΣΤΗΜΙΟ ΑΙΓΑΙΟΥ Μηχανικών Σχεδίασης Προϊόντων και Συστημάτων;Σύρος;9.510
ΕΘΝΙΚΟ , ΚΑΠΟΔΙΣΤΡΙΑΚΟ ΠΑΝΕΠΙΣΤΗΜΙΟ ΑΘΗΝΩΝ (ΕΚΠΑ) Τεχνολογιών Ψηφιακής Βιομηχανίας;Ψαχνά Εύβοιας;9.440
ΠΑΝΕΠΙΣΤΗΜΙΟ ΠΕΛΟΠΟΝΝΗΣΟΥ Ψηφιακών Συστημάτων;Σπάρτη;9.428
ΠΑΝΕΠΙΣΤΗΜΙΟ ΘΕΣΣΑΛΙΑΣ Διοίκησης Επιχειρήσεων;Λάρισα;9.405
ΠΑΝΕΠΙΣΤΗΜΙΟ ΠΕΛΟΠΟΝΝΗΣΟΥ Διοικητικής Επιστήμης και Τεχνολογίας;Τρίπολη;9.350
ΠΑΝΕΠΙΣΤΗΜΙΟ ΘΕΣΣΑΛΙΑΣ Πολιτισμού και Δημιουργικών Μέσων και Βιομηχανιών;Βόλος;9.330
ΠΑΝΕΠΙΣΤΗΜΙΟ ΠΕΛΟΠΟΝΝΗΣΟΥ Παραστατικών και Ψηφιακών Τεχνών;Ναύπλιο;9.250
ΠΑΝΕΠΙΣΤΗΜΙΟ ΔΥΤΙΚΗΣ ΜΑΚΕΔΟΝΙΑΣ Μηχανικών Σχεδίασης Προϊόντων και Συστημάτων;Κοζάνη;9.125
ΠΑΝΕΠΙΣΤΗΜΙΟ ΑΙΓΑΙΟΥ Μηχανικών Οικονομίας και Διοίκησης;Χίος;9.100
ΔΙΕΘΝΕΣ ΠΑΝΕΠΙΣΤΗΜΙΟ ΕΛΛΑΔΑΣ (ΔΙΠΑΕ) Οικονομικών Επιστημών;Σέρρες;9.080
ΔΗΜΟΚΡΙΤΕΙΟ ΠΑΝΕΠΙΣΤΗΜΙΟ ΘΡΑΚΗΣ (ΔΠΘ) Αγροτικής Ανάπτυξης;Ορεστιάδα;9.050
ΠΑΝΕΠΙΣΤΗΜΙΟ ΘΕΣΣΑΛΙΑΣ Δασολογίας, Επιστημών Ξύλου και Σχεδιασμού;Καρδίτσα;9.005
ΙΟΝΙΟ ΠΑΝΕΠΙΣΤΗΜΙΟ Ψηφιακών Μέσων και Επικοινωνίας;Αργοστόλι;8.980
ΔΗΜΟΚΡΙΤΕΙΟ ΠΑΝΕΠΙΣΤΗΜΙΟ ΘΡΑΚΗΣ (ΔΠΘ) Δασολογίας και Διαχείρισης Περιβάλλοντος και Φυσικών Πόρων;Ορεστιάδα;8.950
ΠΑΝΕΠΙΣΤΗΜΙΟ ΔΥΤΙΚΗΣ ΜΑΚΕΔΟΝΙΑΣ Οικονομικών Επιστημών;Καστοριά;8.870
ΠΑΝΕΠΙΣΤΗΜΙΟ ΘΕΣΣΑΛΙΑΣ Λογιστικής και Χρηματοοικονομικής;Λάρισα;8.863
ΠΑΝΕΠΙΣΤΗΜΙΟ ΑΙΓΑΙΟΥ Στατιστικής και Αναλογιστικών - Χρηματοοικονομικών Μαθηματικών;Σάμος;8.825
